{
  "schemaVersion": "2026-06-05.research.deep-research-render-preview-recorded.v1",
  "runtimeId": "research_deep_research_render_preview_runtime",
  "commandPort": "DeepResearchRenderPreviewPort.recordDeepResearchRenderPreview",
  "status": "RENDER_PREVIEW_READY_NOT_PUBLISHED",
  "recordId": "research_deep_research_render_preview_deep-research-render-preview_job-001",
  "recordedAt": "2026-06-05T00:00:00.000Z",
  "idempotencyKey": "deep-research-render-preview:job-001",
  "idempotentReplay": false,
  "job": {
    "taskId": "agent_task_research_deep_001",
    "contextRef": "shared_ctx_research_deep_001",
    "jobId": "deep_research_job_001",
    "queueName": "research_deep_research"
  },
  "preview": {
    "previewId": "deep_research_render_preview_001",
    "previewKind": "EVIDENCE_GROUNDED_RESEARCH_PREVIEW",
    "audience": "TEACHER_REVIEW",
    "format": "SAFE_TEXT_BLOCKS",
    "deliveryState": "PREVIEW_READY_NOT_PUBLISHED",
    "title": "个性化学习与智能教研助手的证据草稿",
    "summary": "当前证据支持把个性化辅导建立在可追踪的学习档案、检索证据和效果指标上。",
    "claims": [
      {
        "claimId": "claim_001",
        "text": "个性化辅导能力需要绑定明确的学习结果指标。",
        "citations": ["public_curriculum_knowledge#source:public-curriculum:001"],
        "sourceHashes": ["sha256:aaaaaaaaaaaaaaaaaaaaaaaaaaaaaaaaaaaaaaaaaaaaaaaaaaaaaaaaaaaaaaaa"],
        "supportChunkIds": ["chunk_public_001"],
        "confidence": 0.82,
        "evidencePreserved": true
      },
      {
        "claimId": "claim_002",
        "text": "私密知识库内容进入综合草稿时必须保留引用和 sourceHash。",
        "citations": ["private_research_notes#source:private-notes:001"],
        "sourceHashes": ["sha256:bbbbbbbbbbbbbbbbbbbbbbbbbbbbbbbbbbbbbbbbbbbbbbbbbbbbbbbbbbbbbbbb"],
        "supportChunkIds": ["chunk_private_001"],
        "confidence": 0.86,
        "evidencePreserved": true
      }
    ],
    "limitations": [
      "该草稿只覆盖已检索到的两个证据片段。",
      "最终发布仍需后续审批边界。"
    ],
    "review": {
      "reviewRecordId": "research_deep_research_final_answer_review_deep-research-final-answer-review_job-001",
      "reviewerPrincipalId": "teacher_research_reviewer_001"
    },
    "finalization": {
      "artifactId": "deep_research_finalization_artifact_001",
      "finalizerPrincipalId": "teacher_research_reviewer_001",
      "deliveryState": "FINALIZED_NOT_PUBLISHED"
    },
    "integrity": {
      "claimCount": 2,
      "citationCount": 2,
      "sourceHashCount": 2,
      "unsafeTextEncoded": true
    }
  },
  "evidenceRefs": [
    "evidence:finalization:job-001",
    "evidence:render-preview-input-hash:sha256:cccccccccccccccccccccccccccccccccccccccccccccccccccccccccccccccc",
    "evidence:runtime:research_deep_research_render_preview_runtime",
    "evidence:command-port:DeepResearchRenderPreviewPort.recordDeepResearchRenderPreview"
  ],
  "boundary": {
    "finalizedArtifactVerified": true,
    "reasoningSynthesisVerified": true,
    "citationIntegrityPreserved": true,
    "sourceHashIntegrityPreserved": true,
    "unsafeTextEncoded": true,
    "renderPreviewRecorded": true,
    "publicationCandidateCreated": false,
    "finalAnswerPublished": false,
    "studentVisible": false,
    "directPublicationAllowed": false,
    "externalModelCallStarted": false,
    "mainDatabaseWriteStarted": false,
    "studentArchiveWriteStarted": false,
    "remoteDeviceControlAllowed": false,
    "localToolMutationAllowed": false,
    "swarmAllowed": false,
    "requiresFuturePublicationReview": true
  },
  "runtimeSlo": {
    "targetP99Ms": 300,
    "evidenceClass": "ASYNC_DEEP_RESEARCH_RENDER_PREVIEW_BOUNDARY"
  },
  "nextAction": "Use this teacher-only preview for future publication review; do not publish or expose it to students directly."
}
